{
  "apiVersion": "ops.sovrunn.io/v1alpha1",
  "kind": "Operation",
  "metadata": {
    "name": "op-delete-tenant-001",
    "uid": "c34d5e6f708192a3b4c5d6e7f8091a2b",
    "displayName": "Tenant Delete Operation",
    "scopeRef": {
      "apiVersion": "tenancy.sovrunn.io/v1alpha1",
      "kind": "Tenant",
      "name": "acme-tenant",
      "uid": "b2c3d4e5f60718293a4b5c6d7e8f901a"
    },
    "labels": {
      "sovrunn.io/operation-scope": "tenant"
    },
    "generation": 1,
    "resourceVersion": "rv-op-tenant-1",
    "createdAt": "2026-07-08T17:00:00Z",
    "updatedAt": "2026-07-08T17:20:00Z"
  },
  "spec": {
    "targetRef": {
      "apiVersion": "tenancy.sovrunn.io/v1alpha1",
      "kind": "Tenant",
      "name": "acme-tenant",
      "uid": "b2c3d4e5f60718293a4b5c6d7e8f901a"
    },
    "action": "Delete",
    "requesterRef": {
      "apiVersion": "identity.sovrunn.io/v1alpha1",
      "kind": "Principal",
      "name": "operator-alice",
      "uid": "7e8f901a2b3c4d5e6f708192a3b4c5d6"
    },
    "idempotencyKey": "idem-tenant-delete-001",
    "requestId": "req-tenant-delete-001"
  },
  "status": {
    "phase": "Failed",
    "progressPercent": 75,
    "retryable": "True",
    "cancelRequested": "False",
    "terminalCode": "DEPENDENCY_BLOCKED",
    "terminalMessage": "Tenant delete blocked by dependent projects.",
    "observedGeneration": 1,
    "conditions": [
      {
        "type": "Failed",
        "status": "True",
        "reason": "DependencyBlocked",
        "message": "Tenant-scoped operation failed retryably.",
        "observedGeneration": 1,
        "lastTransitionTime": "2026-07-08T17:20:00Z"
      }
    ]
  }
}
