{
  "apiVersion": "ops.sovrunn.io/v1alpha1",
  "kind": "Operation",
  "metadata": {
    "name": "op-sync-provider-001",
    "uid": "e56f708192a3b4c5d6e7f8091a2b3c4d",
    "displayName": "Provider Sync Operation",
    "scopeRef": {
      "apiVersion": "fabric.sovrunn.io/v1alpha1",
      "kind": "CloudProvider",
      "name": "sovereign-provider",
      "uid": "d4e5f60718293a4b5c6d7e8f901a2b3c"
    },
    "labels": {
      "sovrunn.io/operation-scope": "provider"
    },
    "generation": 1,
    "resourceVersion": "rv-op-provider-1",
    "createdAt": "2026-07-08T19:00:00Z",
    "updatedAt": "2026-07-08T19:12:00Z"
  },
  "spec": {
    "targetRef": {
      "apiVersion": "fabric.sovrunn.io/v1alpha1",
      "kind": "ResourcePool",
      "name": "postgres-shared-pool",
      "uid": "c3d4e5f60718293a4b5c6d7e8f901a2b"
    },
    "action": "Sync",
    "requesterRef": {
      "apiVersion": "identity.sovrunn.io/v1alpha1",
      "kind": "Principal",
      "name": "operator-alice",
      "uid": "7e8f901a2b3c4d5e6f708192a3b4c5d6"
    },
    "idempotencyKey": "idem-provider-sync-001",
    "requestId": "req-provider-sync-001"
  },
  "status": {
    "phase": "Succeeded",
    "progressPercent": 100,
    "retryable": "False",
    "cancelRequested": "False",
    "terminalCode": "SUCCEEDED",
    "terminalMessage": "Provider-scoped sync completed.",
    "observedGeneration": 1,
    "conditions": [
      {
        "type": "Completed",
        "status": "True",
        "reason": "TerminalSucceeded",
        "message": "Provider-scoped operation completed.",
        "observedGeneration": 1,
        "lastTransitionTime": "2026-07-08T19:12:00Z"
      }
    ]
  }
}
