{
  "apiVersion": "ops.sovrunn.io/v1alpha1",
  "kind": "Operation",
  "metadata": {
    "name": "op-scale-project-001",
    "uid": "d45e6f708192a3b4c5d6e7f8091a2b3c",
    "displayName": "Project Scale Operation",
    "scopeRef": {
      "apiVersion": "core.sovrunn.io/v1alpha1",
      "kind": "Project",
      "name": "payments-production",
      "uid": "a1b2c3d4e5f60718293a4b5c6d7e8f90"
    },
    "labels": {
      "sovrunn.io/operation-scope": "project"
    },
    "generation": 1,
    "resourceVersion": "rv-op-project-1",
    "createdAt": "2026-07-08T18:00:00Z",
    "updatedAt": "2026-07-08T18:08:00Z"
  },
  "spec": {
    "targetRef": {
      "apiVersion": "core.sovrunn.io/v1alpha1",
      "kind": "Project",
      "name": "payments-production",
      "uid": "a1b2c3d4e5f60718293a4b5c6d7e8f90"
    },
    "action": "Scale",
    "requesterRef": {
      "apiVersion": "identity.sovrunn.io/v1alpha1",
      "kind": "Principal",
      "name": "operator-alice",
      "uid": "7e8f901a2b3c4d5e6f708192a3b4c5d6"
    },
    "idempotencyKey": "idem-project-scale-001",
    "requestId": "req-project-scale-001"
  },
  "status": {
    "phase": "Cancelled",
    "progressPercent": 20,
    "retryable": "False",
    "cancelRequested": "True",
    "terminalCode": "CANCELLED",
    "terminalMessage": "Project-scoped operation cancelled by requester.",
    "observedGeneration": 1,
    "conditions": [
      {
        "type": "Cancelled",
        "status": "True",
        "reason": "CancelHonored",
        "message": "Project-scoped operation cancelled.",
        "observedGeneration": 1,
        "lastTransitionTime": "2026-07-08T18:08:00Z"
      }
    ]
  }
}
